"Centiskorch","マルヤクデ","Maruyakude","","","Fire","Bug","3","044","94","4","","","","Fire Lash","Fire","","","","","124","92","54","73","73","54","When it heats up, its body temperature reaches about 1,500 degrees Fahrenheit. It lashes its body like a whip and launches itself at enemies.","はつねつじの たいおんは およそ 800ど。 からだを ムチのように しならせて とびかかってくるぞ。","","","",""
"Mime Jr.","マネネ","Manene","","","Psychic","Fairy","3","045","42","2","","","","Confusion","Psychic","","","","","45","16","27","40","50","35","It mimics everyone it sees, but it puts extra effort into copying the graceful dance steps of Mr. Rime as practice.","みるもの すべての マネを する。 バリコオルの かれいな ステップを ひたすら マネして れんしゅうする。","","","",""
"Galarian Mr. Mime","ガラルバリヤード","Galarian Barrierd","","","Ice","Psychic","3","046","72","3","","","","Icy Wind","Ice","","","","","74","46","46","62","62","69","It can radiate chilliness from the bottoms of its feet. It'll spend the whole day tap-dancing on a frozen floor.","あしの うらから れいきを だす。 こおらせた ゆかの うえで いちにち タップダンスに はげんでいる。","","","",""
"Mr. Rime","バリコオル","Barrikohru","","","Ice","Psychic","3","047","94","4","","","","Freeze-Dry","Ice","","","","","108","69","62","88","81","58","It's highly skilled at tap-dancing. It waves its cane of ice in time with its graceful movements.","タップダンスの たつじん。 こおりで できた ステッキを ふり かろやかな ステップを ひろうする。","","","",""
"Snom","ユキハミ","Yukihami","","","Ice","Bug","3","048","30","2","","","","Powder Snow","Ice","","","","","50","17","22","29","20","14","It spits out thread imbued with a frigid sort of energy and uses it to tie its body to branches, disguising itself as an icicle while it sleeps.","れいきの まざった いとを はく。 いとで からだを えだに まきつけ つららの ふりをして ねむるのだ。","","","",""
"Frosmoth","モスノウ","Mothnow","","","Ice","Bug","3","049","86","4","","","","Aurora Beam","Ice","","","","","101","54","50","100","73","54","Icy scales fall from its wings like snow as it flies over fields and mountains. The temperature of its wings is less than -290 degrees Fahrenheit.","はねの おんどは マイナス１８０ど。 れいきを こめた りんぷんを ゆきの ように ふりまき のやまを とぶ。","","","",""
"Sandile","メグロコ","Meguroco","","","Ground","Dark","3","050","40","2","","","","Sand Tomb","Ground","","","","","60","41","22","22","22","37","It dives into desert sands to prevent its body temperature from dropping. It moves around exposing only its nose and eyes to keep its enemies from finding it.","さばくの すなに もぐり たいおんが さがるのを ふせぐ。 めと はなだけを そとに だして てきに みつからないよう うごきまわる。","","","",""
"Krokorok","ワルビル","Waruvile","","","Ground","Dark","3","051","58","3","","","","Bulldoze","Ground","","","","","80","57","33","33","33","52","Its eyes are protected by a thin membrane that can sense heat, so it can see its surroundings even in the dead of night. They live in groups of a few individuals.","めを まもる うすい まくが ねつを かんじとり まよなかでも まわりが みえる。 すうひきの むれを つくって こうどうする。","","","",""
"Krookodile","ワルビアル","Waruvial","","","Ground","Dark","3","052","92","4","","","","Stomping Tantrum","Ground","","","","","120","93","65","54","58","74","It is known as the Bully of the Sands. Its mighty jaws can bite through heavy plates of iron with almost no effort at all.","すなの ギャングとも よばれる。 きょうりょくな アゴで ぶあつい てっぱんも たやすく くいちぎる。","","","",""
"Tynamo","シビシラス","Shibishirasu","","","Electric","","3","053","40","2","","","","Charge Beam","Electric","","","","","52","33","25","27","25","36","It can only produce a trickle of electricity, but when a group of them gather, they can discharge electricity as powerful as lightning.","よわい でんきしか つくれないが むれになって ちからを あわせることで カミナリと おなじ いりょくの でんきを はなつ。","","","",""
"Eelektrik","シビビール","Shibibeel","","","Electric","","3","054","64","3","","","","Shock Wave","Electric","","","","","83","60","49","53","49","30","The circular patterns on its body emit electricity. It wraps itself around its prey, paralyzes it with electricity, and then chomps.","からだの まるい もようから でんきを はなつ。 えものに まきつき でんきで しびれさせてから まるかじりする。","","","",""
"Eelektross","シビルドン","Shibirudon","","","Electric","","3","055","92","4","","","","Volt Switch","Electric","","","","","112","92","65","84","65","42","They crawl out of the ocean using their arms. They will attack prey on shore and immediately drag it into the ocean.","うでの ちからで うみから はいだし みずべの えものに おそいかかる。 いっしゅんで うみへ ひきずりこむ。","","","",""
"Wingull","キャモメ","Camome","","","Water","Flying","3","056","38","2","","","","Gust","Flying","","","","","55","19","19","34","19","50","It extends it wings and soars away into the sky by catching sea winds. It carries food tucked in its bill.","つばさを のばして うみかぜを うけ おおぞらへ まいあがる。 くちばしに エサを はさんで はこぶ。","","","",""
"Pelipper","ペリッパー","Pelipper","","","Water","Flying","3","057","70","3","","","","Air Slash","Flying","","","","","80","37","69","65","49","46","It can carry small Pokémon and Eggs inside its large bill. If it gets tired, it rests on the sea.","おおきな くちばしに ちいさな ポケモンや タマゴを いれて はこぶ 。 つかれたら うみに うかんで ひとやすみ。","","","",""
"Bonsly","ウソハチ","Usohachi","","","Rock","","3","058","40","2","","","","Rock Throw","Rock","","","","","60","45","52","6","27","6","It looks as if it is always crying, but it is just expelling excess water from its body.","いつも ないているように みえるが からだの よけいな すいぶんを めから そとに だしている だけなのだ。","","","",""
"Sudowoodo","ウソッキー","Usokkie","","","Rock","","3","059","66","3","","","","Rock Slide","Rock","","","","","86","69","78","22","46","22","It mimics a tree to avoid being attacked. Its body appears to be closer to a rock than a plant.","きの まねをして てきに おそわれないようにする。 からだの つくりは しょくぶつより いしや いわに ちかい。","","","",""
"Mudbray","ドロバンコ","Dorobanko","","","Ground","","3","060","62","3","","","","Bulldoze","Ground","","","","","86","69","49","33","40","33","It is stubborn and goes at its own pace. The mud stuck to its feet enhances its powerful running gait.","がんこで マイペース。 どろを まとわりついた あしで じぬんを ふみしぬ ちからづよく はしる。","","","",""
"Mudsdale","バンバドロ","Banbadoro","","","Ground","","3","061","90","4","","","","Stomping Tantrum","Ground","","","","","124","100","81","46","69","31","The mud spat out by Mudsdale was often used to coat the walls of old houses.","むかしの いえの かべには バンバドロが はきだした どろを よく ぬられている。","","","",""
"Fomantis","カリキリ","Karikiri","","","Grass","","3","062","36","2","","","","Leafage","Grass","","","","","55","32","22","30","22","22","It looks for somewhere to sleep during the night and then sleeps and soaks up light during the day.","よるの うちに ねどこを さがし ひるまは ひかりを あびながら ねむっている。","","","",""
"Lurantis","ラランテス","Lalantes","","","Grass","","3","063","74","3","","","","Razor Leaf","Grass","","","","","86","72","62","56","62","33","It fires powerful beams from its sickle-shaped petals. These beams can cut thick metal plates in two.","カマのような はなびらから きょうりょくな ビームを はなつ。 ぶあつい てっぱんも まっぷたつ。","","","",""
"Nosepass","ノズパス","Nosepass","","","Rock","","3","064","60","3","","","","Rock Throw","Rock","","","","","61","33","91","33","62","22","As its nose is a magnet, it always faces north. It uses powerful magnetism to drag its prey toward it.","はなが じしゃくに なっているので いつも きたを むいている。 きょうりょくな じりょくで えものを ひきよせる。","","","",""
"Probopass","ダイノーズ","Dainose","","","Rock","Steel","3","065","94","4","","","","Rock Tomb","Rock","","","","","93","46","115","62","119","35","Although it can control its units known as Mini-Noses, they sometimes get lost and don't come back.","チビノーズと よばれる ユニットを あやつるが たまに まいごに なって かえってこないことも あるらしい。","","","",""
"Ferroseed","テッシード","Tesseed","","","Grass","Steel","3","066","42","2","","","","Metal Claw","Steel","","","","","57","30","50","17","48","10","It sticks its spikes into cave walls. When danger approaches, it attacks by launching spikes.","どうくつの かべに トゲを つきさして はりつく。 きけんが せまると トゲを うちだして はんげきする。","","","",""
"Ferrothorn","ナットレイ","Nutrey","","","Grass","Steel","3","067","88","4","","","","Iron Head","Steel","","","","","104","76","104","46","93","17","It fights by swinging around its three spiky feelers. A hit from these steel spikes can reduce a boulder to rubble.","3ほんの トゲつき しょくしゅを ふりまわして たたかう。 はがねよの トゲは おおいわを ふんさいする はかいりょくだ。","","","",""
"Leafeon","リーフィア","Leafia","","","Grass","","3","068","94","4","","","","Razor Leaf","Grass","","","","","97","88","103","50","54","77","Its cells are closer to those of plants than of animals. It uses photosynthesis to produce clean air.","どうぶつより しょくぶつに ちかい さいぼうを もつ。 こうごうせいを あこなって きれいな くうきを つくりだす。","","","",""
"Glaceon","グレイシア","Glacia","","","Ice","","3","069","94","4","","","","Freeze-Dry","Ice","","","","","97","50","88","103","77","54","It can drop its body temperature below –75 degrees Fahrenheit and create fine ice crystals by cooling the atmosphere.","たいおんを マイナス60どまで さげることが できる。 くうきを ひやして こまかい こおりの けっしょうを つくりだす。","","","",""
"Togedemaru","トゲデマル","Togedemaru","","","Electric","Steel","3","070","68","3","","","","Spark","Electric","","","","","83","67","45","30","51","66","The spiny fur on its back stands on end in battle. It attracts bolts of lightning and stores them as energy in its electric sac.","せなかの ハリを さかだてて たたかう。 かみなりを ひきよせて その でんきを でんきぶくろに ためこむ。","","","",""
"Eternatus","ムゲンダイナ","Mugendina","Superstar","Legendary","Poison","Dragon","4","001","166","6","","","","Dynamax Cannon","Dragon","","","","","215","96","107","161","107","145","It was inside a meteorite that fell 20,000 years ago. There seems to be a connection between this Pokémon and the Dynamax phenomenon.","２まんねんまえに おちた いんせきの なかに いた。 ダイマックスの なぞに かんけいしている らしい。","","","",""
"Eternatus","ムゲンダイナ","Mugendina","Superstar","Legendary","Poison","Dragon","4","002","166","6","","","","Sludge Wave","Poison","","","","","215","96","107","161","107","145","It was inside a meteorite that fell 20,000 years ago. There seems to be a connection between this Pokémon and the Dynamax phenomenon.","２まんねんまえに おちた いんせきの なかに いた。 ダイマックスの なぞに かんけいしている らしい。","","","",""
"Xerneas","ゼルネアス","Xerneas","Superstar","Legendary","Fairy","","4","003","164","6","","","","Moonblast","Fairy","","","","","200","146","107","146","110","111","It is said that when its branched horns sparkle in seven colors, it is bestowing infinite life to other creatures.","えだわかれした ツノを なないろに きらめかせるとき ほかの いきものに むげんの いのちを あたえると いう。","","","",""
"Yveltal","ゼルネアス","Yveltal","Superstar","Legendary","Dark","Flying","4","004","164","6","","","","Dark Pulse","Dark","","","","","200","146","107","146","110","111","It is said that once it sucks the life of other creatures, Yveltal takes the shape of a cocoon.","ほかの いきものの いのちを すいつくした イベルタルは マユのような かたちに なると いう。","","","",""
"Giratina","ギラティナ","Giratina","Superstar","Legendary","Ghost","Dragon","4","005","164","6","","","","Shadow Claw","Ghost","","","","","226","113","134","113","134","102","It apparently gazes silently upon this world from another world, where common knowledge is distorted.","じょうしきの つうようしない べつの せかいから しずかに このよを みているらしい。","","","",""
"Calyrex","バドレックス","Budrex","Superstar","Legendary","Psychic","Ice","4","006","164","6","Reins of Unity","","","Glacial Lance","Ice","","","","","172","183","167","96","145","59","According to lore, this Pokémon showed no mercy to those who got in its way, yet it would heal its opponents' wounds after battle.","みちを はばむものには ようしゃ しないが たたかいの あとは てきの きずでも かまわず いやしたという。","","","",""
"Calyrex","バドレックス","Budrex","Superstar","Legendary","Psychic","Ghost","4","007","164","6","Reins of Unity","","","Astral Barrage","Ghost","","","","","172","96","91","183","113","167","Legend says that by using its power to see all events from past to future, this Pokémon saved the creatures of a forest from a meteorite strike.","かこ みらい すべての できごとを みとおす ちからで いんせきから もりの いきものを すくったらしい。","","","",""
"Grimmsnarl","オーロンゲ","Ohlonge","Superstar","","Dark","Fairy","4","008","128","6","","Dynamax","","Spirit Break"," Fairy","Max Starfall"," Fairy","","","166","134","75","107","86","69","With the hair wrapped around its body helping to enhance its muscles, this Pokémon can overwhelm even Machamp.","かみのけを ぜんしんに まきつけると きんりょくが アップ。 カイリキーを ねじふせる パワーを はっきする。","","","",""
"Dragapult","ドラパルト","Dorapult","Superstar","","Dragon","Ghost","4","009","148","6","","","","Dragon Darts","Dragon","","","","","159","134","86","113","86","158","When it isn't battling, it keeps Dreepy in the holes on its horns. Once a fight starts, it launches the Dreepy like supersonic missiles.","ツノの あなに ドラメシヤを いれて くらす。 たたかいになると マッハの スピードで ドラメシヤを とばす。","","","",""
"Lycanroc","ルガルガン","Lugarugan","Superstar","","Rock","","4","010","122","6","","","Lycanium","Stone Edge","Rock","","","Splintered Stormshards","Rock","145","131","75","64","75","123","It undergoes a special kind of evolution in the twilight of the setting sun. It's very rare in the Alola region.","たそがれどきに ゆうひを あびて とくべつな しんかを した すがた。 アローラちほうでは とても めずらしい。","","","",""
"Tyranitar","バンギラス","Bangiras","Star","","Rock","Dark","4","011","132","5|","","Dynamax","","Stone Edge","Rock","Max Rockfall","Rock","","","154","133","110","96","101","63","Its tremendous power can knock down mountains and bury rivers, changing the surrounding terrain.","やまを くずし かわを うずめ あたりの ちけいを かえてしまう ほどの ものすごい パワーを ひめている。","","","",""
"Metagross","メタグロス","Metagross","Star","","Steel","Psychic","4","012","132","5|","","Dynamax","","Meteor Mash","Steel","Max Steelspike","Steel","","","134","134","129","96","91","72","Formed from the fusion of two Metang, its four brains are said to be superior to a supercomputer.","２ひきの メタングが がったいして うまれた。 ４つの のうは スーパーコンピューターよりも すぐれているといわれる。","","","",""
"Venusaur","フシギバナ","Fushigibana","Star","","Grass","Poison","4","013","116","5","","","Grassium","Leaf Storm","Grass","","","Bloom Doom","Grass","134","83","84","101","101","81","The large plant on its back can convert sunlight into energy.","せなかの おおきな はなで たいようの ひかりを エネルギーに かえることが できる。","","","",""
"Charizard","リザードン","Lizardon","Star","","Fire","Flying","4","014","118","5","","","Firium","Flamethrower","Fire","","","Inferno Overdrive","Fire","132","85","79","109","86","101","The temperature of Charizard's fire increases as it gains experience in battle.","リザードンの ほのおは たたかいの けいけんを つむほど おんどが あがっていく。","","","",""
"Blastoise","カメックス","Kamex","Star","","Water","","4","015","118","5","","","Waterium","Hydro Pump","Water","","","Hydro Vortex","Water","133","84","101","86","105","79","The water fired from the rocket cannons on its shell can penetrate thick steel.","こうらの ロケットほうから ぶあつい てっぱんも つらぬく すいりゅうを ふきだす。","","","",""
"Lucario","ルカリオ","Lucario","Star","","Fighting","Steel","4","016","118","5","","","","Aura Sphere","Fighting","","","","","125","110","72","115","72","91","It can read the aura produced by all things. It can identify others over half a mile away.","あらゆる ものが だす はどうを よみとることができる。 １キロ さきの あいてのことも わかる。","","","",""
"Gardevoir","サーナイト","Sirnight","Star","","Psychic","Fairy","4","017","116","5","","","","Dazzling Gleam","Fairy","","","","","123","67","67","125","115","81","It protects people that it believes in by using the full force of its psychokinetic power to create a small black hole.","しんじあっている ひとを まもるとき ぜんりょくで サイコパワーを つかい ちいさな ブラックホールを つくる。","","","",""
"Alcremie","マホイップ","Mawhip","Star","","Fairy","","4","018","112","5","","","","Dazzling Gleam","Fairy","","","","","120","62","77","110","121","66","When Alcremie is content, the cream it secretes from its hands becomes sweeter and richer.","てから うみだす クリームは マホイップが しあわせなとき あまみと コクが ふかまる。","","","",""
"Flapple","アップリュー","Appryu","Star","","Grass","Dragon","4","019","110","5","","","","Dragon Rush","Dragon","","","","","125","110","81","96","62","72","It flies on wings of apple skin and spits a powerful acid. It can also change its shape into that of an apple.","りんごの かわの つばさで とんで きょうさんせいの だえきを とばす。 りんごの かたちに へんけいする。","","","",""
"Appletun","タルップル","Tarupple","Star","","Grass","Dragon","4","020","110","5","","","","Apple Acid","Grass","","","","","163","86","81","101","81","33","Its body is covered in sweet nectar, and the skin on its back is especially yummy. Children used to have it as a snack.","あまい みつで からだが おおわれ せなかの かわは とくに あまく むかしは こどもの おやつだった。","","","",""
"Gengar","ゲンガー","Gangar","Star","","Ghost","Poison","4","021","112","5","","","","Sludge Wave","Poison","","","","","115","67","62","129","77","110","It steals heat from its surroundings. If the temperature suddenly drops, it is surely the work of a Gengar.","まわりの ねつを うばう。 とつぜん おんどが さがったら ゲンガーの しわざに ちがいない。","","","",""
"Krookodile","ワルビアル","Waruvial","Star","","Ground","Dark","4","022","116","5","","","","Earthquake","Ground","","","","","149","117","81","67","72","93","It is known as the Bully of the Sands. Its mighty jaws can bite through heavy plates of iron with almost no effort at all.","すなの ギャングとも よばれる。 きょうりょくな アゴで ぶあつい てっぱんも たやすく くいちぎる。","","","",""
"Sylveon","ニンフィア","Nymphia","Star","","Fairy","","4","023","116","5","","","","Moonblast","Fairy","","","","","149","67","67","110","129","62","By releasing enmity-erasing waves from its ribbonlike feelers, Sylveon stops any conflict.","リボンのような しょっかくから てきいを けす はどうを はっして あらそいを やめさせる。","","","",""
"Mamoswine","マンムー","Mammoo","Star","","Ice","Ground","4","024","118","5","","","","Earthquake","Ground","","","","","163","129","81","72","62","81","Its impressive tusks are made of ice. It is said the population thinned when it turned warm after the ice age.","りっぱな キバは こおりで できている。 ひょうがきが おわり あたたかく なったので かずが へって しまったと いわれている。","","","",""
"Marshadow","マーシャドー","Marshadow","Star","Mythical","Fighting","Ghost","4","025","132","5","","","","Spectral Thief","Ghost","","","","","144","125","81","91","91","125","It never appears in front of people. It conceals itself in the shadows of others, copying their movements and powers.","ひとまえには すがたを みせず あいての かげの なかに ひそんで うごきや ちからを コピーする。","","","",""
"Rowlet","モクロー","Mokuroh","","","Grass","Flying","4","026","44","2","","","","Leafage","Grass","","","","","69","32","32","30","30","26","Wary and resilient. It uses photosynthesis to build up energy and remains still until it gets dark.","けいかいしんが つよい。 くらく なるまでは こうごうせいで じっと ちからを ためている。","","","",""
"Dartrix","フクスロー","Fukuthrow","","","Grass","Flying","4","027","68","3","","","","Razor Leaf","Grass","","","","","94","54","54","51","51","39","It loves preening its wings; however, its preoccupation with any dirt on its plumage can hinder it in battle.","つばさの ていれが だいすきだが うもうの よごれが きになって たたかいに さしつかえる ことも ある。","","","",""
"Decidueye","ジュナイパー","Junaiper","","","Grass","Ghost","4","028","98","4","","","","Grassy Glide","Grass","","","","","109","88","63","83","83","59","It fires arrow quills from its wings and is able to pierce a pebble from more than a hundred yards away.","つばさの なかに ある やばねを はなつと 100メートル さきの こいしも つらぬくことが できる。","","","",""
"Litten","ニャビー","Nyabby","","","Fire","","4","029","44","2","","","","Ember","Fire","","","","","57","37","24","35","24","40","It grooms itself with its tongue. It sets the built up fur in its stomach alight and spews it out in battle.","からだを なめて けづくろいを する。 おなかに たまった ぬけげを もやし ひを ふいて たたかう。","","","",""
"Torracat","ニャヒート","Nyaheat","","","Fire","","4","030","68","3","","","","Fire Fang","Fire","","","","","85","61","37","57","37","64","The bell of fire on its neck emits a high-pitched sound whenever it spews fire.","くびに つけた ほのおの スズからは たかい おとと ともに ほのおが ふきだすぞ。","","","",""
"Incineroar","ガオガエン","Gaogaen","","","Fire","Dark","4","031","98","4","","","","Fire Punch","Fire","","","","","123","94","75","67","75","51","It has a violent disposition. It finishes opponents off by spewing fire from around its navel.","あらあらしい せいかく。 へその あたりから ふきだす ほのおで あいてに とどめを さす。","","","",""
"Popplio","アシマリ","Ashimari","","","Water","","4","032","44","2","","","","Water Gun","Water","","","","","60","32","32","38","33","24","In battle, it uses inflated balloons made from bodily fluids in a variety of ways.","たいえきを はなで ふくらませた バルーンを つかって たたかう。 その つかいかたは さまざま。","","","",""
"Brionne","オシャマリ","Osyamari","","","Water","","4","033","68","3","","","","Bubble Beam","Water","","","","","82","50","50","65","58","38","It creates a bunch of water balloons as it dances and strikes enemies with them in battle.","みずの バルーンを つぎつぎと つくりだし おどりながら てきに ぶつけて たたかうぞ。","","","",""
