"Primarina","アシレーヌ","Ashirene","","","Water","Fairy","4","034","96","4","","","","Scald","Water","","","","","111","62","62","103","95","51","It sings with a melody that is passed down from others of its kind. It can manipulate water balloons with its singing voice.","むれの なかで うけつがれてきた メロディで うたう。 その うたごえで みずの バルーンを あやつる。","","","",""
"Koffing","ドガース","Dogars","","","Poison","","4","035","46","2","","","","Clear Smog","Poison","","","","","55","37","52","35","27","21","Its thin, membrane-like body is inflated by poison gas. It explodes with the slightest stimulus.","うすい まくの ような からだが どくガスで ふくらんでいる。 かるい しげきで だいばくはつする。","","","",""
"Galarian Weezing","ガラルマタドガス","Galarian Matadogas","","","Poison","Fairy","4","036","90","3","","","","Sludge","Poison","","","","","99","75","98","71","59","51","This Pokémon consumes particles that contaminate the air. Instead of leaving droppings, it expels clean air.","たいきの きたない せいぶんを きゅうしゅうし きれいな くうきを フンの かわりに はきだしている。","","","",""
"Galarian Meowth","ガラルニャース","Galarian Nyarth","","","Steel","","4","037","40","2","","","","Metal Claw","Steel","","","","","60","38","33","25","25","25","These daring Pokémon have coins on their foreheads. Darker coins are harder, and harder coins garner more respect among Meowth.","ひたいの こばんは より くろいほど かたく なかまから そんけいされる。 ゆうもうで おそれを しらない。","","","",""
"Perrserker","ニャイキング","Nyaiking","","","Steel","","4","038","72","3","","","","Iron Head","Steel","","","","","89","77","71","37","44","38","What appears to be an iron helmet is actually hardened hair. This Pokémon lives for the thrill of battle.","あたまの たいもうが こうしつかして てつの ヘルメットのように なった。 とても こうせんてきな せいしつ。","","","",""
"Milcery","マホミル","Mahomil","","","Fairy","","4","039","38","2","","","","Draining Kiss","Fairy","","","","","57","25","25","30","35","21","This Pokémon was born from sweet-smelling particles in the air. Its body is made of cream.","クリームで できた からだを もつ。 くうきちゅうの あまい かおりの せいぶんが あつまって うまれた。","","","",""
"Alcremie","マホイップ","Mawhip","","","Fairy","","4","040","92","4","","","","Draining Kiss","Fairy","","","","","99","51","63","90","99","54","When Alcremie is content, the cream it secretes from its hands becomes sweeter and richer.","てから うみだす クリームは マホイップが しあわせなとき あまみと コクが ふかまる。","","","",""
"Applin","カジッチュ","Kajicchu","","","Grass","Dragon","4","041","38","2","","","","Astonish","Ghost","","","","","55","25","45","25","25","14","As soon as it's born, it burrows into an apple. Not only does the apple serve as its food source, but the flavor of the fruit determines its evolution.","うまれると りんごに もぐりこむ。 なかみを たべながら せいちょうし りんごの あじが しんかを きめる。","","","",""
"Flapple","アップリュー","Appryu","","","Grass","Dragon","4","042","90","4","","","","Dragon Pulse","Dragon","","","","","103","90","67","79","51","59","It flies on wings of apple skin and spits a powerful acid. It can also change its shape into that of an apple.","りんごの かわの つばさで とんで きょうさんせいの だえきを とばす。 りんごの かたちに へんけいする。","","","",""
"Appletun","タルップル","Tarupple","","","Grass","Dragon","4","043","90","4","","","","Seed Bomb","Grass","","","","","134","71","67","83","67","26","Its body is covered in sweet nectar, and the skin on its back is especially yummy. Children used to have it as a snack.","あまい みつで からだが おおわれ せなかの かわは とくに あまく むかしは こどもの おやつだった。","","","",""
"Silicobra","スナヘビ","Sunahebi","","","Ground","","4","044","44","2","","","","Bulldoze","Ground","","","","","61","33","42","22","30","28","It spews sand from its nostrils. While the enemy is blinded, it burrows into the ground to hide.","はなの あなから すなを ふんしゃ。 てきの めを くらました すきに ちちゅうに もぐって みを かくす。","","","",""
"Sandaconda","サダイジャ","Sadaija","","","Ground","","4","045","94","4","","","","Dig","Ground","","","","","105","88","102","55","59","60","When it contracts its body, over 220 pounds of sand sprays from its nose. If it ever runs out of sand, it becomes disheartened.","ぜんしんを ちぢめ １００キロの すなを はなの あなから ふんしゃ。 すなが ないと よわきに なるぞ。","","","",""
"Stonjourner","イシヘンジン","Ishihengin","","","Rock","","4","046","88","4","","","","Rock Slide","Rock","","","","","127","102","110","17","17","59","Once a year, on a specific date and at a specific time, they gather out of nowhere and form up in a circle.","1ねんに いちど きまった にちじに どこから ともなく あつまり わに なって ならぶ しゅうせいが ある。","","","",""
"Ralts","ラルトス","Ralts","","","Psychic","Fairy","4","047","32","2","","","","Disarming Voice","Fairy","","","","","49","17","17","29","22","25","The red horns that grow from its head sense the feelings of people. It hides if it senses hostility.","あたまに はえた あかい ツノで ひとの きもちを さっちするが てきいが あると かくれる。","","","",""
"Kirlia","キルリア","Kirlia","","","Psychic","Fairy","4","048","50","3","","","","Draining Kiss","Fairy","","","","","68","27","27","47","41","38","It uses the horns on its head to amplify its psychokinetic power. It can distort space and see into the future.","あたまの ツノで サイコパワーを ぞうふく。 くうかんが ねじまげて みらいの できごとを みとおす。","","","",""
"Gardevoir","サーナイト","Sirnight","","","Psychic","Fairy","4","049","96","4","","","","Psyshock","Psychic","","","","","102","55","55","102","94","67","It protects people that it believes in by using the full force of its psychokinetic power to create a small black hole.","しんじあっている ひとを まもるとき ぜんりょくで サイコパワーを つかい ちいさな ブラックホールを つくる。","","","",""
"Trapinch","ナックラー","Nuckrar","","","Ground","","4","050","40","2","","","","Sand Tomb","Ground","","","","","57","55","27","27","27","6","Its nest is a sloped, bowl-like pit in the desert. Once something has fallen in, there is no escape.","さばくに つくられた すあなは すりばちの かたちを しているので おちてしまうと だっしゅつふかのう。","","","",""
"Vibrava","ビブラーバ","Vibrava","","","Ground","Dragon","4","051","58","3","","","","Dragon Tail","Dragon","","","","","76","51","38","38","38","51","The ultrasonic waves it generates by rubbing its two wings together cause severe headaches.","2まいの ハネを こうそくで しんどうさせて だす ちょうおんぱは はげしい ずつうを ひきおこす。","","","",""
"Flygon","フライゴン","Flygon","","","Ground","Dragon","4","052","96","4","","","","Dragon Claw","Dragon","","","","","111","83","67","67","67","83","This Pokémon hides in the heart of sandstorms it creates and seldom appears where people can see it.","みずからが まきおこす すなあらしの ちゅうしんに いるので めったに ひとまえに あらわれない ポケモン。","","","",""
"Gastly","ゴース","Ghos","","","Ghost","Poison","4","053","42","2","","","","Lick","Ghost","","","","","50","22","20","60","22","48","95% of its body is made of poisonous gas. Its body is thin however, and can be blown away by wind.","からだの 95パーセントが どくガスで できている 。 うすい かぜが ふくと からだが ふきとばされてしまう。","","","",""
"Haunter","ゴースト","Ghost","","","Ghost","Poison","4","054","66","3","","","","Shadow Punch","Ghost","","","","","72","38","34","80","41","67","It stalks prey while lurking in the dark. It steals the life away of those licked with its gaseous tongue.","くらやみに ひそんご えものを ねらう。 ガスじょうの したで なめられると いのちを すわれて しまう。","","","",""
"Gengar","ゲンガー","Gangar","","","Ghost","Poison","4","055","92","4","","","","Hex","Ghost","","","","","95","55","51","106","63","90","It steals heat from its surroundings. If the temperature suddenly drops, it is surely the work of a Gengar.","まわりの ねつを うばう。 とつぜん おんどが さがったら ゲンガーの しわざに ちがいない。","","","",""
"Rhyhorn","サイホーン","Sihorn","","","Ground","Rock","4","056","46","2","","","","Smack Down","Rock","","","","","75","47","57","18","18","15","It can remember only one thing at a time. Once it starts to charge and run, it forgets why it started.","ひとつの ことしか おぼえられない。 いちど とっしんを はじめると はしっている りゆうを わすれてしまう。","","","",""
"Rhydon","サイドン","Sidon","","","Ground","Rock","4","057","78","3","","","","Rock Tomb","Rock","","","","","112","90","84","32","32","29","Its horn, which serves as a drill, can shatter uncut diamonds. Its thick hide protects it even in magma.","ドリルになる ツノで ダイヤの げんせきも コナゴナに できる。 ぶあつい ひふは マグマの なかでも へいき。","","","",""
"Rhyperior","ドサイドン","Dosidon","","","Ground","Rock","4","058","98","4","","","","Rock Slide","Rock","","","","","138","114","106","47","47","34","It puts rocks in the holes in its palms and uses its muscles to shoot them. Geodude are shot on occasion.","てのひらの あなに いわを つめて きんにくの ちからで はっしゃする。 たまに イシツブテを とばす。","","","",""
"Alolan Grimer","アローラベトベター","","","","Poison","Dark","4","059","56","2","","","","Poison Fang","Poison","","","","","95","57","38","31","38","19","It loves feeding on garbage and sludge, so is unable to live in a sterile environment. The crystals on its body are lumps of toxins.","ゴミや ヘドロが だいこうぶつで せいけつな ばしょでは いきていけない。 からだの けっしょうは どくその かたまりだ。","","","",""
"Alolan Muk","アローラベトベトン","","","","Poison","Dark","4","060","92","4","","","","Poison Jab","Poison","","","","","130","86","63","55","83","43","The garbage it eats causes chemical changes in its body, which produce its vivid appearance.","たベた ゴミが からだの なかで かがくへんかを おこして あざやかな いるを つくりだして いるのだ。","","","",""
"Riolu","リオル","Riolu","","","Fighting","","4","061","40","3","","","","Metal Claw","Steel","","","","","55","40","24","21","24","35","They communicate with one another using their auras. Their aura becomes stronger when in a pinch.","なかま どうしで はどうを だして コミュニケーションを とる。 ピンチのときは はどうが つよまる。","","","",""
"Lucario","ルカリオ","Lucario","","","Fighting","Steel","4","062","82","4","","","","Flash Cannon","Steel","","","","","89","77","51","80","51","64","It can read the aura produced by all things. It can identify others over half a mile away.","あらゆる ものが だす はどうを よみとることができる。 １キロ さきの あいてのことも わかる。","","","",""
"Stufful","ヌイコグマ","Nuikoguma","","","Normal","Fighting","4","063","58","3","","","","Tackle","Normal","","","","","89","54","38","34","38","38","It is very dangerous when angry, as it will begin to act violently. Its powerful arms and legs can knock away a pro wrestler.","おこって あばれだすと ひじょうに キケン。 きょうりょくな てあしで プロレスラーも ふっとばす。","","","",""
"Bewear","キテルグマ","Kiteruguma","","","Normal","Fighting","4","064","92","4","","","","Strength","Normal","","","","","142","102","67","47","51","51","It hugs companions with its tremendously powerful arms. It is dangerous and a risk to human life.","ものすごい ちからの りょううでで なかまを だきしめ。 にんげんが やられると いのちが あぶない。","","","",""
"Alolan Diglett","アローラディグダ","","","","Ground","Steel","4","065","38","2","","","","Metal Claw","Steel","","","","","40","32","19","22","27","50","It uses its golden hairs to monitor its surroundings and relay communication amongst comrades.","きんいろの ヒゲで まわりの ようすを キャッチしたり なかまどうしで こうしんすろぞ。","","","",""
"Alolan Dugtrio","アローラダグトリオ","","","","Ground","Steel","4","066","70","3","","","","Bulldoze","Ground","","","","","66","71","44","38","51","77","In the Alola region, it said to be the feminine deity of the land incarnate. Its shining gold hair provides it with protection.","アローラちほうでは だいちの めがみの けしんと いわれる。 きんいろの ヒゲで みを まもる。","","","",""
"Mareanie","ヒドイデ","Hidoide","","","Poison","Water","4","067","54","3","","","","Venoshock","Poison","","","","","76","39","45","33","39","34","It can be found crawling on beaches and seafloors. It catches prey with its 10 tentacles and weakens them with its poison spike.","うみの そこや かいがんを はいまわっている。 どくを もった トゲで あいてを よわらせ １０ぽんの しょくしゅで とらえる。","","","",""
"Toxapex","ドヒドイデ","Dohidoide","","","Poison","Water","4","068","92","4","","","","Cross Poison","Poison","","","","","88","54","124","46","116","30","It moves along the seafloor on its 12 legs. Those attacked by Toxapex's poison will suffer for three days and three nights.","１２ほんの あしで かいていを うごきまわる。 ドヒドイデの どくに やられると ３か３ばん くるしむことに なるぞ。","","","",""
"Sylveon","ニンフィア","Nymphia","","","Fairy","","4","069","96","4","","","","Dazzling Gleam","Fairy","","","","","123","55","55","90","106","51","By releasing enmity-erasing waves from its ribbonlike feelers, Sylveon stops any conflict.","リボンのような しょっかくから てきいを けす はどうを はっして あらそいを やめさせる。","","","",""
"Onix","イワーク","Iwark","","","Rock","Ground","4","070","64","3","","","","Bulldoze","Ground","","","","","66","34","110","22","34","51","It burrows through the ground at a speed of 80 km/h. It has a magnet in its brain, which acts as a compass and prevents it from losing direction while tunneling.","じそく80キロで ちちゅうを ほりすすみ。 のうみそに じしゃくが あるので つちの なかでも ほうこうを まちがえない。","","","",""
"Solgaleo","ソルガレオ","Solgaleo","Superstar","Legendary","Psychic","Steel","2-1","001","172","6","","","","Sunsteel Strike","Steel","","","","","223","161","126","133","106","115","The dazzling light unleashed from its body can make the darkest of nights light up like midday.","からだから まぶしい ひかりを はなち やみよも まひるのように てらしだす。","","","",""
"Lunala","ルナアーラ","Lunala","Superstar","Legendary","Psychic","Ghost","2-1","002","172","6","","","","Moongeist Beam","Ghost","","","","","223","133","106","161","126","115","It is said that when its third eye appears on its forehead, it will fly to another world.","だい3の めが ひたいに うかびあがると べつせかいへ とびさって いくと いわれる。","","","",""
"Urshifu","ウーラオス","Wulaosu","Superstar","Legendary","Fighting","Dark","2-1","003","144","6","","","","Wicked Blow","Dark","","","","","181","153","119","76","73","115","This form of Urshifu is a strong believer in the one-hit KO. Its strategy is to leap in close to foes and land a devastating blow with a hardened fist.","いちげきひっさつが しんじょう。 あいての ふところに とびこみ きたえられた こぶしを たたきこむ。","","","",""
"Urshifu","ウーラオス","Wulaosu","Superstar","Legendary","Fighting","Water","2-1","004","144","6","","","","Surging Strikes","Water","","","","","181","153","119","76","73","115","It's believed that this Pokémon modeled its fighting style on the flow of a river — sometimes rapid, sometimes calm.","ときに はげしく ときに おだやかな かわの ながれから かくとうわざの かたを あみだしたと いわれている。","","","",""
"Ho-Oh","ホウオウ","Houou","Superstar","Legendary","Fire","Flying","2-1","005","172","6","","","","Sacred Fire","Fire","","","","","187","153","107","130","180","107","It flies the skies on its seven-colored wings. Legends claim that a rainbow forms behind it.","なないろの つばさで そらを とぶ。 そのあとには にじが できると しんわに つたえられている。","","","",""
"Rillaboom","ゴリランダー","Gorirander","Superstar","","Grass","","2-1","006","138","6","","Dynamax","","Drum Beating","Grass","Max Overgrowth","Grass","","","181","147","107","73","84","101","By drumming, it taps into the power of its special tree stump. The Rillaboom with the best drumming techniques becomes the boss of the troop.","とくべつな きりかぶの パワーを ドラミングで コントロール。 ドラムテクニックに すぐれた ゴリランダーが なかまたちの ボスになる。","","","",""
"Cinderace","エースバーン","Aceburn","Superstar","","Fire","","2-1","007","138","6","","Dynamax","","Pyro Ball","Fire","Max Flare","Fire","","","158","137","90","79","90","140","It juggles a pebble with its feet, turning it into a burning soccer ball, and strikes opponents hard with its shots.","こいしを リフティングして ほのおの サッカーボールを つくりだし するどい シュートで こうげきする。","","","",""
"Inteleon","インテレオン","Intereon","Superstar","","Water","","2-1","008","138","6","","Dynamax","","Snipe Shot","Water","Max Geyser","Water","","","146","101","79","147","79","141","It has many hidden capabilities, such as fingertips that can shoot water and a membrane on its back that it can use to glide through the air.","たさいな きのうを かくしもつ。 ゆびから みずを ふんしゃして せなかの ひまくで かぜに のる。","","","",""
"Dragonite","カイリュー","Kairyu","Superstar","","Dragon","Flying","2-1","009","154","6","","","Dragonium","Dragon Rush","Dragon","","","Devastating Drake","Dragon","170","157","113","119","119","96","It is called the "guardian of the sea". It flies over the vast seas and rescues drowning people.","うみのけしんと よばれる。 ひろい うみを とびまわって おぼれているひとを たすける。","","","",""
"Salamence","ボーマンダ","Bohmander","Superstar","","Dragon","Flying","2-1","010","154","6","","","","Dragon Rush","Dragon","","","","","175","158","96","130","96","119","Its cellular structure changed, and its long-sought wings grew out. It flies around the sky while spouting flames.","からだの さいぼうが へんかして ねんがんの つばさが はえてきた。 ほのおを はきながら そらを とびまわるぞ。","","","",""
"Lucario","ルカリオ","Lucario","Star","","Fighting","Steel","2-1","011","124","5","","","","Aura Sphere","Fighting","","","","","132","117","76","122","76","96","","","Gengar","094","Shadow Ball","Ghost"
"Cinderace","エースバーン","Aceburn","Star","","Fire","","2-1","012","124","5","","","","Pyro Ball","Fire","","","","","142","123","81","71","81","126","","","Scizor","212","X-Scissor","Bug"
"Meganium","メガニウム","Meganium","Star","","Grass","","2-1","013","124","5","","","Grassium","Solar Beam","Grass","","","Bloom Doom","Grass","142","88","107","89","107","86","In battle, its petals give off a soothting scent that blunt an opponent's fighting spirit.","きもちを しずめる かおりを はなびらから はっさんして てきの たたかう きもちを にぶらせる。","","","",""
"Typhlosion","バクフーン","Bakphoon","Star","","Fire","","2-1","014","126","5","","","Firium","Flamethrower","Fire","","","Inferno Overdrive","Fire","140","90","84","116","91","107","It attacks using blasts of fire. It creates heat shimmers with intense fire to hide itself.","ほのおの ばくふうで こうげき。 しゃくねつの ほのおで かげろうを つくりだし すがたを かくす。","","","",""
"Feraligatr","オーダイル","Ordile","Star","","Water","","2-1","015","124","5","","","Waterium","Hydro Pump","Water","","","Hydro Vortex","Water","147","112","107","85","89","84","It uses its powerful hind legs to charge opponents while biting. It goes at blinding speed.","あいてに かみつく ときは たくましい うしろあしを つかって とっしん。 めにも とまらない スピードだ。","","","",""
"Pikachu","ピカチュウ","Pikachu","Star","","Electric","","2-1","016","108","5","","","","Thunderbolt","Electric","","","","","125","79","59","73","73","127","","","Zekrom","644","Fusion Bolt","Electric"
"Gyarados","ギャラドス","Gyarados","Star","","Water","Flying","2-1","017","126","5|","","Dynamax","","Waterfall","Water","Max Geyser","Water","","","157","132","85","66","107","87","A ferocious and dangerous Pokémon. It cannot be stopped once it goes on a rampage.","どうもうで きけんな ポケモン。 いちど あばれだしたが さいご もう とめられない。","","","",""
"Dracozolt","パッチラゴン","Patchiragon","Star","","Electric","Dragon","2-1","018","120","5","","","","Thunder","Electric","","","","","152","107","96","86","76","81","In ancient times, it was unbeatable thanks to its powerful lower body, but it went extinct anyway after it depleted all its plant-based food sources.","こだいでは たくましい かはんしんで むてきだったが エサの しょくぶつを たべつくしてしまい ぜつめつした。","","","",""
"Dracovish","ウオノラゴン","Uonoragon","Star","","Water","Dragon","2-1","019","120","5","","","","Outrage","Dragon","","","","","152","96","107","76","86","81","Its mighty legs are capable of running at speeds exceeding 40 mph, but this Pokémon can't breathe unless it's underwater.","じそく60キロを こえる じまんの きゃくりょくで はしれるが すいちゅうでしか こきゅうできない。","","","",""
"Copperajah","ダイオウドウ","Daioudou","Star","","Steel","","2-1","020","118","5","","","","Iron Head","Steel","","","","","185","137","75","86","75","35","They came over from another region long ago and worked together with humans. Their green skin is resistant to water.","みどりのひふは みずにも つよい。 むかし ほかのとちから やってきて ひとと いっしょに はたらいた。","","","",""
"Haxorus","オノノクス","Ononokus","Star","","Dragon","","2-1","021","126","5","","","","Outrage","Dragon","","","","","138","154","96","66","76","103","While usually kindhearted, it can be terrifying if angered. Tusks that can slice through steel beams are how Haxorus deals with its adversaries.","おんこうな せいしつだが おこると こわい。 てっこつをも きりさく じまんの キバを おみまい するぞ。","","","",""
"Cobalion","コバルオン","Cobalon","Star","Legendary","Steel","Fighting","2-1","022","134","5","","","","Iron Head","Steel","","","","","153","96","136","96","78","115","It is told in legend that it battled against humans to protect Pokémon. It has a body and heart of steel.","ポケモンを まもるため にんげんと たたかった でんせつに かたられている。 はがねの こころと からだを もつ。","","","",""
"Terrakion","テラキオン","Terrakion","Star","Legendary","Rock","Fighting","2-1","023","134","5","","","","Stone Edge","Rock","","","","","153","136","96","78","96","115","It is told in legend that it battled against humans to protect Pokémon. It has enough power to destroy a castle.","ポケモンを まもるため にんげんと たたかった でんせつに かたられている。 しろを こわすほどの パワーを もつ。","","","",""
"Virizion","ビリジオン","Virizion","Star","Legendary","Grass","Fighting","2-1","024","134","5","","","","Leaf Blade","Grass","","","","","153","96","78","96","136","115","It is told in legend that it battled against humans to protect Pokémon. It confounds opponents with its swift movements.","ポケモンを まもるため にんげんと たたかった でんせつに かたられている。 てきを ほんろうする すばやさを もつ。","","","",""
